[
  {
    "authority": "7dtd",
    "base_revision": 0,
    "components": {
      "health": {
        "current": 93,
        "max": 100
      },
      "name": {
        "display_name": "\u8d28\u6734\u4e14\u5351\u5fae-",
        "text": "\u8d28\u6734\u4e14\u5351\u5fae-"
      },
      "custom_metadata": {
        "tag.source": "7dtd",
        "tag.kind": "player",
        "tag.label": "bridge"
      }
    },
    "dimension": "7dtd:main",
    "entity_id": "5379c3ed-876b-4702-8420-365330557e73",
    "entity_sequence": 1,
    "entity_state_version": 2,
    "entity_type": "7dtd:player",
    "mode": "snapshot",
    "origin": {
      "dimension": "7dtd:main",
      "entity_id": "5379c3ed-876b-4702-8420-365330557e73",
      "game": "7dtd",
      "world_id": "td-0d917a4eff776d999148769266591579674d2c42de6557026893a1902834f11f"
    },
    "revision": 1,
    "source": "7dtd",
    "stream_id": "64516623-0a28-4c89-b419-bc09e2d2847e",
    "type": "entity_components",
    "version": 1,
    "world_id": "td-0d917a4eff776d999148769266591579674d2c42de6557026893a1902834f11f"
  },
  {
    "authority": "7dtd",
    "base_revision": 1,
    "components": {
      "health": {
        "current": 94,
        "max": 100
      }
    },
    "dimension": "7dtd:main",
    "entity_id": "5379c3ed-876b-4702-8420-365330557e73",
    "entity_sequence": 62,
    "entity_state_version": 2,
    "entity_type": "7dtd:player",
    "mode": "patch",
    "origin": {
      "dimension": "7dtd:main",
      "entity_id": "5379c3ed-876b-4702-8420-365330557e73",
      "game": "7dtd",
      "world_id": "td-0d917a4eff776d999148769266591579674d2c42de6557026893a1902834f11f"
    },
    "revision": 2,
    "source": "7dtd",
    "stream_id": "64516623-0a28-4c89-b419-bc09e2d2847e",
    "type": "entity_components",
    "version": 1,
    "world_id": "td-0d917a4eff776d999148769266591579674d2c42de6557026893a1902834f11f"
  },
  {
    "authority": "7dtd",
    "base_revision": 2,
    "components": {
      "name": {
        "display_name": "MC7DTD Identity Updated",
        "text": "\u8d28\u6734\u4e14\u5351\u5fae-"
      },
      "custom_metadata": {
        "tag.source": "7dtd",
        "tag.kind": "player",
        "tag.label": "runtime-update"
      }
    },
    "dimension": "7dtd:main",
    "entity_id": "5379c3ed-876b-4702-8420-365330557e73",
    "entity_sequence": 111,
    "entity_state_version": 2,
    "entity_type": "7dtd:player",
    "mode": "patch",
    "origin": {
      "dimension": "7dtd:main",
      "entity_id": "5379c3ed-876b-4702-8420-365330557e73",
      "game": "7dtd",
      "world_id": "td-0d917a4eff776d999148769266591579674d2c42de6557026893a1902834f11f"
    },
    "revision": 3,
    "source": "7dtd",
    "stream_id": "64516623-0a28-4c89-b419-bc09e2d2847e",
    "type": "entity_components",
    "version": 1,
    "world_id": "td-0d917a4eff776d999148769266591579674d2c42de6557026893a1902834f11f"
  },
  {
    "authority": "7dtd",
    "base_revision": 3,
    "components": {
      "health": {
        "current": 95,
        "max": 100
      }
    },
    "dimension": "7dtd:main",
    "entity_id": "5379c3ed-876b-4702-8420-365330557e73",
    "entity_sequence": 178,
    "entity_state_version": 2,
    "entity_type": "7dtd:player",
    "mode": "patch",
    "origin": {
      "dimension": "7dtd:main",
      "entity_id": "5379c3ed-876b-4702-8420-365330557e73",
      "game": "7dtd",
      "world_id": "td-0d917a4eff776d999148769266591579674d2c42de6557026893a1902834f11f"
    },
    "revision": 4,
    "source": "7dtd",
    "stream_id": "64516623-0a28-4c89-b419-bc09e2d2847e",
    "type": "entity_components",
    "version": 1,
    "world_id": "td-0d917a4eff776d999148769266591579674d2c42de6557026893a1902834f11f"
  },
  {
    "authority": "7dtd",
    "base_revision": 4,
    "components": {
      "health": {
        "current": 96,
        "max": 100
      }
    },
    "dimension": "7dtd:main",
    "entity_id": "5379c3ed-876b-4702-8420-365330557e73",
    "entity_sequence": 296,
    "entity_state_version": 2,
    "entity_type": "7dtd:player",
    "mode": "patch",
    "origin": {
      "dimension": "7dtd:main",
      "entity_id": "5379c3ed-876b-4702-8420-365330557e73",
      "game": "7dtd",
      "world_id": "td-0d917a4eff776d999148769266591579674d2c42de6557026893a1902834f11f"
    },
    "revision": 5,
    "source": "7dtd",
    "stream_id": "64516623-0a28-4c89-b419-bc09e2d2847e",
    "type": "entity_components",
    "version": 1,
    "world_id": "td-0d917a4eff776d999148769266591579674d2c42de6557026893a1902834f11f"
  },
  {
    "authority": "7dtd",
    "base_revision": 5,
    "components": {
      "name": null,
      "custom_metadata": null
    },
    "dimension": "7dtd:main",
    "entity_id": "5379c3ed-876b-4702-8420-365330557e73",
    "entity_sequence": 329,
    "entity_state_version": 2,
    "entity_type": "7dtd:player",
    "mode": "patch",
    "origin": {
      "dimension": "7dtd:main",
      "entity_id": "5379c3ed-876b-4702-8420-365330557e73",
      "game": "7dtd",
      "world_id": "td-0d917a4eff776d999148769266591579674d2c42de6557026893a1902834f11f"
    },
    "revision": 6,
    "source": "7dtd",
    "stream_id": "64516623-0a28-4c89-b419-bc09e2d2847e",
    "type": "entity_components",
    "version": 1,
    "world_id": "td-0d917a4eff776d999148769266591579674d2c42de6557026893a1902834f11f"
  },
  {
    "authority": "7dtd",
    "base_revision": 6,
    "components": {
      "name": {
        "display_name": "\u8d28\u6734\u4e14\u5351\u5fae-",
        "text": "\u8d28\u6734\u4e14\u5351\u5fae-"
      },
      "custom_metadata": {
        "tag.source": "7dtd",
        "tag.kind": "player",
        "tag.label": "bridge"
      }
    },
    "dimension": "7dtd:main",
    "entity_id": "5379c3ed-876b-4702-8420-365330557e73",
    "entity_sequence": 367,
    "entity_state_version": 2,
    "entity_type": "7dtd:player",
    "mode": "patch",
    "origin": {
      "dimension": "7dtd:main",
      "entity_id": "5379c3ed-876b-4702-8420-365330557e73",
      "game": "7dtd",
      "world_id": "td-0d917a4eff776d999148769266591579674d2c42de6557026893a1902834f11f"
    },
    "revision": 7,
    "source": "7dtd",
    "stream_id": "64516623-0a28-4c89-b419-bc09e2d2847e",
    "type": "entity_components",
    "version": 1,
    "world_id": "td-0d917a4eff776d999148769266591579674d2c42de6557026893a1902834f11f"
  },
  {
    "authority": "7dtd",
    "base_revision": 7,
    "components": {
      "health": {
        "current": 97,
        "max": 100
      }
    },
    "dimension": "7dtd:main",
    "entity_id": "5379c3ed-876b-4702-8420-365330557e73",
    "entity_sequence": 414,
    "entity_state_version": 2,
    "entity_type": "7dtd:player",
    "mode": "patch",
    "origin": {
      "dimension": "7dtd:main",
      "entity_id": "5379c3ed-876b-4702-8420-365330557e73",
      "game": "7dtd",
      "world_id": "td-0d917a4eff776d999148769266591579674d2c42de6557026893a1902834f11f"
    },
    "revision": 8,
    "source": "7dtd",
    "stream_id": "64516623-0a28-4c89-b419-bc09e2d2847e",
    "type": "entity_components",
    "version": 1,
    "world_id": "td-0d917a4eff776d999148769266591579674d2c42de6557026893a1902834f11f"
  },
  {
    "authority": "7dtd",
    "base_revision": 8,
    "components": {
      "health": null,
      "name": null,
      "custom_metadata": null
    },
    "dimension": "7dtd:main",
    "entity_id": "5379c3ed-876b-4702-8420-365330557e73",
    "entity_sequence": 467,
    "entity_state_version": 2,
    "entity_type": "7dtd:player",
    "mode": "patch",
    "origin": {
      "dimension": "7dtd:main",
      "entity_id": "5379c3ed-876b-4702-8420-365330557e73",
      "game": "7dtd",
      "world_id": "td-0d917a4eff776d999148769266591579674d2c42de6557026893a1902834f11f"
    },
    "revision": 9,
    "source": "7dtd",
    "stream_id": "64516623-0a28-4c89-b419-bc09e2d2847e",
    "type": "entity_components",
    "version": 1,
    "world_id": "td-0d917a4eff776d999148769266591579674d2c42de6557026893a1902834f11f"
  }
]